[
  {
    "schema_version": 1,
    "rule_id": "normalize-card-payment",
    "name": "Card payment transfer",
    "stage": "TRANSACTION_NORMALIZATION",
    "priority": 10,
    "match": {
      "any": [
        {
          "all": [
            {
              "field": "transaction_type",
              "operator": "equals",
              "value": "PAYMENT"
            }
          ]
        },
        {
          "all": [
            {
              "field": "merchant_raw",
              "operator": "contains_any",
              "value": [
                "PAYMENT RECEIVED",
                "CARD PAYMENT",
                "CARD PMT",
                "AUTOPAY PAYMENT",
                "FAB BLUE PAYMENT"
              ]
            }
          ]
        }
      ]
    },
    "actions": [
      {
        "action": "set",
        "field": "transaction_type",
        "value": "TRANSFER",
        "sequence": 10
      },
      {
        "action": "set_if_empty",
        "field": "category",
        "value": "Card Payments",
        "sequence": 20
      },
      {
        "action": "add_tags",
        "value": [
          "transfer",
          "card-payment"
        ],
        "sequence": 30
      }
    ],
    "stop_on_match": true,
    "rule_sets": ["FULL_LEDGER"]
  },
  {
    "schema_version": 1,
    "rule_id": "normalize-salary-credit",
    "name": "Salary income credit",
    "stage": "TRANSACTION_NORMALIZATION",
    "priority": 11,
    "match": {
      "any": [{
        "all": [
          {"field": "transaction_type", "operator": "equals", "value": "CREDIT"},
          {"field": "merchant_raw", "operator": "contains", "value": "SALARY TRANSFER"}
        ]
      }]
    },
    "actions": [
      {"action": "set", "field": "transaction_type", "value": "INCOME", "sequence": 10},
      {"action": "set_if_empty", "field": "category", "value": "Salary", "sequence": 20},
      {"action": "add_tags", "value": ["income", "salary"], "sequence": 30}
    ],
    "stop_on_match": true,
    "rule_sets": ["FULL_LEDGER"]
  },
  {
    "schema_version": 1,
    "rule_id": "normalize-explicit-account-transfer",
    "name": "Explicit account-to-account transfer",
    "stage": "TRANSACTION_NORMALIZATION",
    "priority": 12,
    "match": {
      "any": [{
        "all": [
          {"field": "transaction_type", "operator": "equals", "value": "CREDIT"},
          {
            "field": "merchant_raw",
            "operator": "contains_any",
            "value": ["TRANSFER BETWEEN OWN ACCOUNTS", "TRANSFER FROM OTHER FAB ACCOUNT"]
          }
        ]
      }]
    },
    "actions": [
      {"action": "set", "field": "transaction_type", "value": "TRANSFER", "sequence": 10},
      {"action": "set_if_empty", "field": "category", "value": "Needs Review", "sequence": 20},
      {"action": "add_tags", "value": ["transfer", "review"], "sequence": 30}
    ],
    "stop_on_match": true,
    "rule_sets": ["FULL_LEDGER"]
  },
  {
    "schema_version": 1,
    "rule_id": "normalize-inward-bill-reimbursement",
    "name": "Incoming bill reimbursement",
    "stage": "TRANSACTION_NORMALIZATION",
    "priority": 13,
    "match": {
      "any": [{
        "all": [
          {"field": "transaction_type", "operator": "equals", "value": "CREDIT"},
          {"field": "merchant_raw", "operator": "contains", "value": "INWARD IPP PAYMENT"}
        ]
      }]
    },
    "actions": [
      {"action": "set", "field": "transaction_type", "value": "REFUND", "sequence": 10},
      {"action": "set_if_empty", "field": "category", "value": "Refunds & Reimbursements", "sequence": 20},
      {"action": "add_tags", "value": ["refund", "reimbursement"], "sequence": 30}
    ],
    "stop_on_match": true,
    "rule_sets": ["FULL_LEDGER"]
  },
  {
    "schema_version": 1,
    "rule_id": "normalize-ambiguous-incoming-transfer",
    "name": "Ambiguous incoming bank transfer",
    "stage": "TRANSACTION_NORMALIZATION",
    "priority": 14,
    "match": {
      "any": [{
        "all": [
          {"field": "transaction_type", "operator": "equals", "value": "CREDIT"},
          {"field": "merchant_raw", "operator": "equals", "value": "Transfer within UAE"}
        ]
      }]
    },
    "actions": [
      {"action": "set", "field": "transaction_type", "value": "INCOME", "sequence": 10},
      {"action": "set_if_empty", "field": "category", "value": "Needs Review", "sequence": 20},
      {"action": "add_tags", "value": ["income", "review"], "sequence": 30}
    ],
    "stop_on_match": true,
    "rule_sets": ["FULL_LEDGER"]
  },
  {
    "schema_version": 1,
    "rule_id": "normalize-outgoing-card-payment",
    "name": "Outgoing payment to another credit card",
    "stage": "TRANSACTION_NORMALIZATION",
    "priority": 15,
    "match": {
      "any": [{
        "all": [{"field": "merchant_raw", "operator": "contains", "value": "TRANSFER TO OTHER BANK CREDIT CARD"}]
      }]
    },
    "actions": [
      {"action": "set", "field": "transaction_type", "value": "TRANSFER", "sequence": 10},
      {"action": "set_if_empty", "field": "category", "value": "Card Payments", "sequence": 20},
      {"action": "add_tags", "value": ["transfer", "card-payment"], "sequence": 30}
    ],
    "stop_on_match": true,
    "rule_sets": ["FULL_LEDGER"]
  },
  {
    "schema_version": 1,
    "rule_id": "normalize-outgoing-bank-transfer",
    "name": "Outgoing bank transfer",
    "stage": "TRANSACTION_NORMALIZATION",
    "priority": 16,
    "match": {
      "any": [{
        "all": [{
          "field": "merchant_raw",
          "operator": "contains_any",
          "value": [
            "IPP TRANSFER-MOB-LOCAL FT",
            "STANDING ORDER - TRANSFER WITHIN UAE",
            "TRANSFER TO OTHER FAB ACCOUNT"
          ]
        }]
      }]
    },
    "actions": [
      {"action": "set", "field": "transaction_type", "value": "TRANSFER", "sequence": 10},
      {"action": "set_if_empty", "field": "category", "value": "Needs Review", "sequence": 20},
      {"action": "add_tags", "value": ["transfer", "review"], "sequence": 30}
    ],
    "stop_on_match": true,
    "rule_sets": ["FULL_LEDGER"]
  },
  {
    "schema_version": 1,
    "rule_id": "normalize-cashback-credit",
    "name": "Cashback and reward credit",
    "stage": "TRANSACTION_NORMALIZATION",
    "priority": 20,
    "match": {
      "any": [
        {
          "all": [
            {
              "field": "source_direction",
              "operator": "equals",
              "value": "CREDIT"
            },
            {
              "field": "merchant_raw",
              "operator": "contains_any",
              "value": [
                "CASHBACK",
                "CASH BACK",
                "REWARD CREDIT",
                "RDMPTION"
              ]
            }
          ]
        }
      ]
    },
    "actions": [
      {
        "action": "set",
        "field": "transaction_type",
        "value": "REWARD_CREDIT"
      },
      {
        "action": "set_if_empty",
        "field": "category",
        "value": "Cashback & Rewards",
        "sequence": 20
      },
      {
        "action": "add_tag",
        "value": "reward",
        "sequence": 30
      }
    ],
    "stop_on_match": true,
    "rule_sets": ["FULL_LEDGER"]
  },
  {
    "schema_version": 1,
    "rule_id": "normalize-refund",
    "name": "Explicit refund or reversal",
    "stage": "TRANSACTION_NORMALIZATION",
    "priority": 30,
    "match": {
      "any": [
        {
          "all": [
            {
              "field": "merchant_raw",
              "operator": "regex",
              "value": "\\b(REFUND|REVERSAL|REVERSED)\\b"
            }
          ]
        }
      ]
    },
    "actions": [
      {
        "action": "set",
        "field": "transaction_type",
        "value": "REFUND"
      },
      {
        "action": "set_if_empty",
        "field": "category",
        "value": "Refunds & Reimbursements",
        "sequence": 20
      },
      {
        "action": "add_tag",
        "value": "refund",
        "sequence": 30
      }
    ],
    "stop_on_match": true,
    "rule_sets": [
      "FULL_LEDGER",
      "LIVE_CASHBACK"
    ]
  },
  {
    "schema_version": 1,
    "rule_id": "normalize-fab-merchant-credit",
    "name": "FAB merchant refund credit",
    "stage": "TRANSACTION_NORMALIZATION",
    "priority": 31,
    "match": {
      "any": [{
        "all": [
          {"field": "card", "operator": "equals", "value": "FAB_6031"},
          {"field": "transaction_type", "operator": "equals", "value": "CREDIT"},
          {"field": "merchant_raw", "operator": "contains_any", "value": ["AMAZON.AE", "PAYPAL *SKYHOUND"]}
        ]
      }]
    },
    "actions": [
      {"action": "set", "field": "transaction_type", "value": "REFUND", "sequence": 10},
      {"action": "set_if_empty", "field": "category", "value": "Refunds & Reimbursements", "sequence": 20},
      {"action": "add_tag", "value": "refund", "sequence": 30}
    ],
    "stop_on_match": true,
    "rule_sets": ["FULL_LEDGER"]
  },
  {
    "schema_version": 1,
    "rule_id": "normalize-fab-installment-adjustment",
    "name": "FAB installment credit adjustment",
    "stage": "TRANSACTION_NORMALIZATION",
    "priority": 32,
    "match": {
      "any": [{
        "all": [
          {"field": "institution", "operator": "equals", "value": "FAB"},
          {"field": "transaction_type", "operator": "equals", "value": "CREDIT"},
          {"field": "merchant_raw", "operator": "regex", "value": "^INST[A-Z0-9]+$"}
        ]
      }]
    },
    "actions": [
      {"action": "set", "field": "transaction_type", "value": "REFUND", "sequence": 10},
      {"action": "set_if_empty", "field": "category", "value": "Needs Review", "sequence": 20},
      {"action": "add_tags", "value": ["adjustment", "review"], "sequence": 30}
    ],
    "stop_on_match": true,
    "rule_sets": ["FULL_LEDGER"]
  },
  {
    "schema_version": 1,
    "rule_id": "vendor-ace",
    "name": "Normalize ACE Hardware",
    "stage": "VENDOR_NORMALIZATION",
    "priority": 1,